reference_id,authors,title,journal,year,volume,citation_footer,citation_type,citation,urls,pubmed_id,doi,header,reference_type,study_id,PUBMED_ID_TITLE_AUTHORS,PUBMED_ID_TITLE,PUBMED_ID_S2,N_CITATIONS,S2_PDF_LINK,CORE_PDF_LINK,PUBMED_ID
CD013588-bib-0018,"Adamska E, Helwich E, Rutkowska M, Zacharska E, Piotrowska A. ",Comparison of the efficacy of ibuprofen and indomethacin in the treatment of patent ductus arteriosus in prematurely born infants, Medycyna Wieku Rozwojowego ,2005,9,    ,['citation-journal']," Adamska E, Helwich E, Rutkowska M, Zacharska E, Piotrowska A. Comparison of the efficacy of ibuprofen and indomethacin in the treatment of patent ductus arteriosus in prematurely born infants [Porownanie ibuprofenu i indometacyny w leczeniu przetrwalego przewodu tetniczego u noworodkow urodzonych przedwczesnie].  Medycyna Wieku Rozwojowego 2005;9(3 Pt 1):335-54. CENTRAL [PMID: 16547381]    PubMed     Google Scholar     ","['', 'https://www.ncbi.nlm.nih.gov/pubmed/16547381', 'https://scholar.google.com/scholar_lookup?title=Comparison+of+the+efficacy+of+ibuprofen+and+indomethacin+in+the+treatment+of+patent+ductus+arteriosus+in+prematurely+born+infants+&author=E+Adamska&author=E+Helwich&author=M+Rutkowska&author=E+Zacharska&author=A+Piotrowska&publication_year=2005&hl=en']",16547381,, Adamska 2005 ,additional,CD013588-bbs2-0018,16547381,16547381,,,,,16547381
CD013588-bib-0019,"Akar M, Yildirim TG, Sandal G, Bozdag S, Erdeve O, Altug N, et al. ",Does ibuprofen treatment in patent ductus arteriosus alter oxygen free radicals in premature infants?, Cardiology in the Young ,2017,27,    ,['citation-journal']," Akar M, Yildirim TG, Sandal G, Bozdag S, Erdeve O, Altug N, et al. Does ibuprofen treatment in patent ductus arteriosus alter oxygen free radicals in premature infants? Cardiology in the Young 2017;27(3):507–11. CENTRAL [PMID: 27319277]    Link to article     PubMed     Google Scholar     ","['', 'https://doi.org/10.1017/S1047951116000822', 'https://www.ncbi.nlm.nih.gov/pubmed/27319277', 'https://scholar.google.com/scholar_lookup?title=Does+ibuprofen+treatment+in+patent+ductus+arteriosus+alter+oxygen+free+radicals+in+premature+infants?+&author=M+Akar&author=TG+Yildirim&author=G+Sandal&author=S+Bozdag&author=O+Erdeve&author=N+Altug&publication_year=2017&hl=en']",27319277,https://doi.org/10.1017/S1047951116000822, Akar 2017 ,additional,CD013588-bbs2-0019,,27319277,,,,,27319277
CD013588-bib-0020,"Akisu M, Ozyurek AR, Dorak C, Parlar A, Kultursay N. ",Enteral ibuprofen versus indomethacin in the treatment of patent ductus arteriosus in preterm newborn infants, Cocuk Sagligi ve Hastaliklari Dergisi ,2001,44,    ,['citation-journal']," Akisu M, Ozyurek AR, Dorak C, Parlar A, Kultursay N. Enteral ibuprofen versus indomethacin in the treatment of patent ductus arteriosus in preterm newborn infants [Premature bebeklerde patent duktus arteriozusun tedavisinde enteral ibuprofen ve indometazinin etkinligi ve guvenilirligi].  Cocuk Sagligi ve Hastaliklari Dergisi 2001;44(1):56-60. CENTRAL    Google Scholar     ","['', 'https://scholar.google.com/scholar_lookup?title=Enteral+ibuprofen+versus+indomethacin+in+the+treatment+of+patent+ductus+arteriosus+in+preterm+newborn+infants+&author=M+Akisu&author=AR+Ozyurek&author=C+Dorak&author=A+Parlar&author=N+Kultursay&publication_year=2001&hl=en']",,, Akisu 2001 ,additional,CD013588-bbs2-0020,,,,,,,
CD013588-bib-0021,"Al-Lawama M, Alammori I, Abdelghani T, Badran E. ",Oral paracetamol versus oral ibuprofen for treatment of patent ductus arteriosus, Journal of International Medical Research ,2017,46,    ,['citation-journal']," Al-Lawama M, Alammori I, Abdelghani T, Badran E. Oral paracetamol versus oral ibuprofen for treatment of patent ductus arteriosus.  Journal of International Medical Research 2017;46(2):811-8. CENTRAL [DOI: 10.1177/0300060517722698] [PMID: 29239259]    Link to article     PubMed     Google Scholar     ","['', 'https://doi.org/10.1177/0300060517722698', 'https://www.ncbi.nlm.nih.gov/pubmed/29239259', 'https://scholar.google.com/scholar_lookup?title=Oral+paracetamol+versus+oral+ibuprofen+for+treatment+of+patent+ductus+arteriosus&author=M+Al-Lawama&author=I+Alammori&author=T+Abdelghani&author=E+Badran&publication_year=2017&hl=en']",29239259,https://doi.org/10.1177/0300060517722698, Al‐Lawama 2017 ,additional,CD013588-bbs2-0021,29239259,,,,,,29239259
CD013588-bib-0022,"Aly H, Lotfy W, Badrawi N, Ghawas M, Abdel-Meguid IE, Hammad TA. ",Oral ibuprofen and ductus arteriosus in premature infants: a randomized pilot study, American Journal of Perinatology ,2007,24,    ,['citation-journal']," Aly H, Lotfy W, Badrawi N, Ghawas M, Abdel-Meguid IE, Hammad TA. Oral ibuprofen and ductus arteriosus in premature infants: a randomized pilot study.  American Journal of Perinatology 2007;24(5):267-70. CENTRAL [PMID: 17484080]    Link to article     PubMed     Google Scholar     ","['', 'https://doi.org/10.1055/s-2007-976550', 'https://www.ncbi.nlm.nih.gov/pubmed/17484080', 'https://scholar.google.com/scholar_lookup?title=Oral+ibuprofen+and+ductus+arteriosus+in+premature+infants:+a+randomized+pilot+study&author=H+Aly&author=W+Lotfy&author=N+Badrawi&author=M+Ghawas&author=IE+Abdel-Meguid&author=TA+Hammad&publication_year=2007&hl=en']",17484080,https://doi.org/10.1055/s-2007-976550, Aly 2007 ,additional,CD013588-bbs2-0022,17484080,,,,,,17484080
CD013588-bib-0023,"Aranda JV, Clyman R, Cox B, Van Overmeire B, Wozniak P, Sosenko I, et al. ","A randomized, double-blind, placebo-controlled trial of intravenous ibuprofen L-lysine for the early closure of non-symptomatic patent ductus arteriosus within 72 hours of birth in extremely low-birth-weight infants", American Journal of Perinatology ,2009,26,    ,['citation-journal']," Aranda JV, Clyman R, Cox B, Van Overmeire B, Wozniak P, Sosenko I, et al. A randomized, double-blind, placebo-controlled trial of intravenous ibuprofen L-lysine for the early closure of non-symptomatic patent ductus arteriosus within 72 hours of birth in extremely low-birth-weight infants.  American Journal of Perinatology 2009;26(3):235-45. CENTRAL [DOI: 10.1055/s-0028-1103515] [PMID: 19067286]    Link to article     PubMed     Google Scholar     ","['', 'https://doi.org/10.1055/s-0028-1103515', 'https://www.ncbi.nlm.nih.gov/pubmed/19067286', 'https://scholar.google.com/scholar_lookup?title=A+randomized,+double-blind,+placebo-controlled+trial+of+intravenous+ibuprofen+L-lysine+for+the+early+closure+of+non-symptomatic+patent+ductus+arteriosus+within+72+hours+of+birth+in+extremely+low-birth-weight+infants+&author=JV+Aranda&author=R+Clyman&author=B+Cox&author=B+VanOvermeire&author=P+Wozniak&author=I+Sosenko&publication_year=2009&hl=en']",19067286,https://doi.org/10.1055/s-0028-1103515, Aranda 2009 ,additional,CD013588-bbs2-0023,,,,,,,19067286
CD013588-bib-0024,"Asadpour N, Harandi PS, Hamidi M, Malek Ahmadi MR, Malekpour-Tehrani A. ",Comparison of the effect of oral acetaminophen and ibuprofen on patent ductus arteriosus closure in premature infants referred to Hajar hospital in Shahrekord in 2016-2017, Journal of Clinical Neonatology ,2018,7,    ,['citation-journal']," Asadpour N, Harandi PS, Hamidi M, Malek Ahmadi MR, Malekpour-Tehrani A. Comparison of the effect of oral acetaminophen and ibuprofen on patent ductus arteriosus closure in premature infants referred to Hajar hospital in Shahrekord in 2016-2017.  Journal of Clinical Neonatology 2018;7(4):224-30. CENTRAL [DOI: 10.4103/jcn.JCN_47_18]    Google Scholar     ","['', 'https://scholar.google.com/scholar_lookup?title=Comparison+of+the+effect+of+oral+acetaminophen+and+ibuprofen+on+patent+ductus+arteriosus+closure+in+premature+infants+referred+to+Hajar+hospital+in+Shahrekord+in+2016-2017+&author=N+Asadpour&author=PS+Harandi&author=M+Hamidi&author=MR+MalekAhmadi&author=A+Malekpour-Tehrani&publication_year=2018&hl=en']",,, Asadpour 2018 ,additional,CD013588-bbs2-0024,,,,,,,
CD013588-bib-0025,"Asbagh PA, Zarkesh MR, Nili F, Sadat Nayeri FS, Naeem AT. ",Prophylactic treatment with oral paracetamol for patent ductus arteriosus in preterm infants: a randomized clinical trial, Tehran University Medical Journal ,2015,73,    ,['citation-journal']," Asbagh PA, Zarkesh MR, Nili F, Sadat Nayeri FS, Naeem AT. Prophylactic treatment with oral paracetamol for patent ductus arteriosus in preterm infants: a randomized clinical trial.  Tehran University Medical Journal 2015;73(2):86-92. CENTRAL [tumj.tums.ac.ir/article-1-6603-en.html]    Google Scholar     ","['', 'https://scholar.google.com/scholar_lookup?title=Prophylactic+treatment+with+oral+paracetamol+for+patent+ductus+arteriosus+in+preterm+infants:+a+randomized+clinical+trial+&author=PA+Asbagh&author=MR+Zarkesh&author=F+Nili&author=FS+SadatNayeri&author=AT+Naeem&publication_year=2015&hl=en']",,, Asbagh 2015 ,additional,CD013588-bbs2-0025,,,,,,,
CD013588-bib-0026,"Babaei H, Nemati R, Daryoshi H. ",Closure of patent ductus arteriosus with oral acetaminophen in preterm neonates: a randomized trial, Biomedical Research and Therapy ,2018,5,    ,['citation-journal']," Babaei H, Nemati R, Daryoshi H. Closure of patent ductus arteriosus with oral acetaminophen in preterm neonates: a randomized trial.  Biomedical Research and Therapy 2018;5(2):2034-44. CENTRAL [DOI: 10.15419/bmrat.v5i02.418]    Link to article     Google Scholar     ","['', 'https://doi.org/10.15419/bmrat.v5i02.418', 'https://scholar.google.com/scholar_lookup?title=Closure+of+patent+ductus+arteriosus+with+oral+acetaminophen+in+preterm+neonates:+a+randomized+trial+&author=H+Babaei&author=R+Nemati&author=H+Daryoshi&publication_year=2018&hl=en']",,https://doi.org/10.15419/bmrat.v5i02.418, Babaei 2018 ,additional,CD013588-bbs2-0026,,,,,,,
CD013588-bib-0027,"Bada HS, Green RS, Pourcyrous M, Leffler CW, Korones SB, Magill HL, et al. ",Indomethacin reduces the risks of severe intraventricular hemorrhage, Journal of Pediatrics ,1989,115,    ,['citation-journal']," Bada HS, Green RS, Pourcyrous M, Leffler CW, Korones SB, Magill HL, et al. Indomethacin reduces the risks of severe intraventricular hemorrhage.  Journal of Pediatrics 1989;115(4):631-7. [PMID: 2677294]    Link to article     PubMed     Google Scholar     ","['https://doi.org/10.1016/S0022-3476(89)80300-2', 'https://www.ncbi.nlm.nih.gov/pubmed/2677294', 'https://scholar.google.com/scholar_lookup?title=Indomethacin+reduces+the+risks+of+severe+intraventricular+hemorrhage&author=HS+Bada&author=RS+Green&author=M+Pourcyrous&author=CW+Leffler&author=SB+Korones&author=HL+Magill&publication_year=1989&hl=en']",2677294,https://doi.org/10.1016/S0022-3476(89)80300-2, Bada 1989 ,additional,CD013588-bbs2-0027,,,,,,,2677294
CD013588-bib-0028,"Baenziger O, Waldvogel K, Ghelfi D, Arbenz U, Fanconi S. ",Can dopamine prevent the renal side effects of indomethacin? A prospective randomized clinical study, Klinische Padiatrie ,1999,211,    ,['citation-journal']," Baenziger O, Waldvogel K, Ghelfi D, Arbenz U, Fanconi S. Can dopamine prevent the renal side effects of indomethacin? A prospective randomized clinical study.  Klinische Padiatrie 1999;211(6):438-41. [PMID: 10592922]    Link to article     PubMed     Google Scholar     ","['https://doi.org/10.1055/s-2008-1043829', 'https://www.ncbi.nlm.nih.gov/pubmed/10592922', 'https://scholar.google.com/scholar_lookup?title=Can+dopamine+prevent+the+renal+side+effects+of+indomethacin?+A+prospective+randomized+clinical+study+&author=O+Baenziger&author=K+Waldvogel&author=D+Ghelfi&author=U+Arbenz&author=S+Fanconi&publication_year=1999&hl=en']",10592922,https://doi.org/10.1055/s-2008-1043829, Baenziger 1999 ,additional,CD013588-bbs2-0028,10592922,10592922,,,,,10592922
CD013588-bib-0029,"Bagheri MM, Niknafs P, Sabsevari F, Torabi MH, Bahman Bijari B, Noroozi E, et al. ",Comparison of oral acetaminophen versus ibuprofen in premature infants with patent ductus arteriosus, Iranian Journal of Pediatrics ,2016,26,    ,['citation-journal']," Bagheri MM, Niknafs P, Sabsevari F, Torabi MH, Bahman Bijari B, Noroozi E, et al. Comparison of oral acetaminophen versus ibuprofen in premature infants with patent ductus arteriosus.  Iranian Journal of Pediatrics 2016;26(4):e3975. CENTRAL [DOI: 10.5812/ijp.3975] [PMID: 27713809]    Link to article     PubMed     Google Scholar     ","['', 'https://doi.org/10.5812/ijp.3975', 'https://www.ncbi.nlm.nih.gov/pubmed/27713809', 'https://scholar.google.com/scholar_lookup?title=Comparison+of+oral+acetaminophen+versus+ibuprofen+in+premature+infants+with+patent+ductus+arteriosus+&author=MM+Bagheri&author=P+Niknafs&author=F+Sabsevari&author=MH+Torabi&author=B+BahmanBijari&author=E+Noroozi&publication_year=2016&hl=en']",27713809,https://doi.org/10.5812/ijp.3975, Bagheri 2016 ,additional,CD013588-bbs2-0029,,,,,,,27713809
CD013588-bib-0030,"Bagheri M, Bahman-Bijari B, Torabi-Nejad M, Niknafs P, Mousavi H, Fatemeh S, et al. ",Is prophylactic parenteral paracetamol effective to diminish incidence of PDA in preterm neonates? A randomized trial, Iranian Journal of Pediatrics ,2018,28,    ,['citation-journal']," Bagheri M, Bahman-Bijari B, Torabi-Nejad M, Niknafs P, Mousavi H, Fatemeh S, et al. Is prophylactic parenteral paracetamol effective to diminish incidence of PDA in preterm neonates? A randomized trial.  Iranian Journal of Pediatrics 2018;28(4):e11735. CENTRAL [DOI: 10.5812/ijp.11735]    Link to article     Google Scholar     ","['', 'https://doi.org/10.5812/ijp.11735', 'https://scholar.google.com/scholar_lookup?title=Is+prophylactic+parenteral+paracetamol+effective+to+diminish+incidence+of+PDA+in+preterm+neonates?+A+randomized+trial+&author=M+Bagheri&author=B+Bahman-Bijari&author=M+Torabi-Nejad&author=P+Niknafs&author=H+Mousavi&author=S+Fatemeh&publication_year=2018&hl=en']",,https://doi.org/10.5812/ijp.11735, Bagheri 2018 ,additional,CD013588-bbs2-0030,,,,,,,
CD013588-bib-0031,"Bagnoli F, Rossetti A, Messina G, Mori A, Casucci M, Tomasini B. ",Treatment of patent ductus arteriosus (PDA) using ibuprofen: renal side-effects in VLBW and ELBW newborns, Journal of Maternal-Fetal and Neonatal Medicine ,2013,26,    ,['citation-journal']," Bagnoli F, Rossetti A, Messina G, Mori A, Casucci M, Tomasini B. Treatment of patent ductus arteriosus (PDA) using ibuprofen: renal side-effects in VLBW and ELBW newborns.  Journal of Maternal-Fetal and Neonatal Medicine 2013;26(4):423-9. [DOI: 10.3109/14767058.2012.733775] [PMID: 23057804]    Link to article     PubMed     Google Scholar     ","['https://doi.org/10.3109/14767058.2012.733775', 'https://www.ncbi.nlm.nih.gov/pubmed/23057804', 'https://scholar.google.com/scholar_lookup?title=Treatment+of+patent+ductus+arteriosus+(PDA)+using+ibuprofen:+renal+side-effects+in+VLBW+and+ELBW+newborns+&author=F+Bagnoli&author=A+Rossetti&author=G+Messina&author=A+Mori&author=M+Casucci&author=B+Tomasini&publication_year=2013&hl=en']",23057804,https://doi.org/10.3109/14767058.2012.733775, Bagnoli 2013 ,additional,CD013588-bbs2-0031,23057804,,,,,,23057804
CD013588-bib-0032,"Balachander B, Mondal N, Bhat V, Adhisivam B, Kumar M, Satheesh S, et al. ",Comparison of efficacy of oral paracetamol versus ibuprofen for PDA closure in preterms - a prospective randomized clinical trial, Journal of Maternal-fetal & Neonatal Medicine ,2020,33,    ,['citation-journal']," Balachander B, Mondal N, Bhat V, Adhisivam B, Kumar M, Satheesh S, et al. Comparison of efficacy of oral paracetamol versus ibuprofen for PDA closure in preterms - a prospective randomized clinical trial.  Journal of Maternal-fetal & Neonatal Medicine 2020;33(9):1587-92. CENTRAL [DOI: 10.1080/14767058.2018.1525354] [PMID: 30227731]    Link to article     Google Scholar     ","['', 'https://doi.org/10.1080/14767058.2018.1525354', 'https://scholar.google.com/scholar_lookup?title=Comparison+of+efficacy+of+oral+paracetamol+versus+ibuprofen+for+PDA+closure+in+preterms+-+a+prospective+randomized+clinical+trial+&author=B+Balachander&author=N+Mondal&author=V+Bhat&author=B+Adhisivam&author=M+Kumar&author=S+Satheesh&publication_year=2020&hl=en']",,https://doi.org/10.1080/14767058.2018.1525354, Balachander 2020 ,additional,CD013588-bbs2-0032,,30227731,,,,,30227731
CD013588-bib-0033,Ballabh P. ,Intraventricular hemorrhage in premature infants: mechanism of disease, Pediatric Research ,2010,67,    ,['citation-journal'], Ballabh P. Intraventricular hemorrhage in premature infants: mechanism of disease.  Pediatric Research 2010;67(1):1-8. [DOI: 10.1203/PDR.0b013e3181c1b176] [PMID: 19816235]    Link to article     PubMed     Google Scholar     ,"['https://doi.org/10.1203/PDR.0b013e3181c1b176', 'https://www.ncbi.nlm.nih.gov/pubmed/19816235', 'https://scholar.google.com/scholar_lookup?title=Intraventricular+hemorrhage+in+premature+infants:+mechanism+of+disease&author=P+Ballabh&publication_year=2010&hl=en']",19816235,https://doi.org/10.1203/PDR.0b013e3181c1b176, Ballabh 2010 ,additional,CD013588-bbs2-0033,40054597,,,,,,19816235
CD013588-bib-0034,"Bandstra ES, Montalvo BM, Goldberg RN, Pacheco I, Ferrer PL, Flynn J, et al. ",Prophylactic indomethacin for prevention of intraventricular hemorrhage in premature infants, Pediatrics ,1988,82,    ,['citation-journal']," Bandstra ES, Montalvo BM, Goldberg RN, Pacheco I, Ferrer PL, Flynn J, et al. Prophylactic indomethacin for prevention of intraventricular hemorrhage in premature infants.  Pediatrics 1988;82(4):533-42. [PMID: 3174314]    Link to article     PubMed     Google Scholar     ","['https://doi.org/10.1542/peds.82.4.533', 'https://www.ncbi.nlm.nih.gov/pubmed/3174314', 'https://scholar.google.com/scholar_lookup?title=Prophylactic+indomethacin+for+prevention+of+intraventricular+hemorrhage+in+premature+infants+&author=ES+Bandstra&author=BM+Montalvo&author=RN+Goldberg&author=I+Pacheco&author=PL+Ferrer&author=J+Flynn&publication_year=1988&hl=en']",3174314,https://doi.org/10.1542/peds.82.4.533, Bandstra 1988 ,additional,CD013588-bbs2-0034,,,,,,,3174314
CD013588-bib-0035,"Barzilay B, Youngster I, Batash D, Keidar R, Baram S, Goldman M, et al. ",Pharmacokinetics of oral ibuprofen for patent ductus arteriosus closure in preterm infants, Archives of Disease in Childhood. Fetal Neonatal Edition ,2012,97,    ,['citation-journal']," Barzilay B, Youngster I, Batash D, Keidar R, Baram S, Goldman M, et al. Pharmacokinetics of oral ibuprofen for patent ductus arteriosus closure in preterm infants.  Archives of Disease in Childhood. Fetal Neonatal Edition 2012;97(2):116-9. [DOI: 10.1136/adc.2011.215160] [PMID: 21840880]    Link to article     Google Scholar     ","['https://doi.org/10.1136/adc.2011.215160', 'https://scholar.google.com/scholar_lookup?title=Pharmacokinetics+of+oral+ibuprofen+for+patent+ductus+arteriosus+closure+in+preterm+infants+&author=B+Barzilay&author=I+Youngster&author=D+Batash&author=R+Keidar&author=S+Baram&author=M+Goldman&publication_year=2012&hl=en']",,https://doi.org/10.1136/adc.2011.215160, Barzilay 2012 ,additional,CD013588-bbs2-0035,,,,,,,
CD013588-bib-0036,"Baud O, Maury L, Lebail F, Ramful D, El Moussawi F, Nicaise C, et al, PREMILOC trial study group. ","Effect of early low-dose hydrocortisone on survival without bronchopulmonary dysplasia in extremely preterm infants (PREMILOC): a double-blind, placebo-controlled, multicentre, randomised trial", Lancet ,2016,387,    ,['citation-journal']," Baud O, Maury L, Lebail F, Ramful D, El Moussawi F, Nicaise C, et al, PREMILOC trial study group. Effect of early low-dose hydrocortisone on survival without bronchopulmonary dysplasia in extremely preterm infants (PREMILOC): a double-blind, placebo-controlled, multicentre, randomised trial.  Lancet 2016;387(10030):1827-36. [DOI: 10.1016/S0140-6736(16)00202-6]    Link to article     PubMed     Google Scholar     ","['https://doi.org/10.1016/S0140-6736(16)00202-6', 'https://www.ncbi.nlm.nih.gov/pubmed/26916176', 'https://scholar.google.com/scholar_lookup?title=Effect+of+early+low-dose+hydrocortisone+on+survival+without+bronchopulmonary+dysplasia+in+extremely+preterm+infants+(PREMILOC):+a+double-blind,+placebo-controlled,+multicentre,+randomised+trial+&author=O+Baud&author=L+Maury&author=F+Lebail&author=D+Ramful&author=F+ElMoussawi&author=C+Nicaise&publication_year=2016&hl=en']",26916176,https://doi.org/10.1016/S0140-6736(16)00202-6, Baud 2016 ,additional,CD013588-bbs2-0036,,26916176,,,,,26916176
CD013588-bib-0037,"Bell MJ, Ternberg JL, Feigin RD, Keating JP, Marshall R, Barton L, et al. ",Neonatal necrotizing enterocolitis. Therapeutic decisions based upon clinical staging, Annals of Surgery ,1978,187,    ,['citation-journal']," Bell MJ, Ternberg JL, Feigin RD, Keating JP, Marshall R, Barton L, et al. Neonatal necrotizing enterocolitis. Therapeutic decisions based upon clinical staging.  Annals of Surgery 1978;187(1):1-7. [DOI: 10.1097/00000658-197801000-00001] [PMID: 413500]    Link to article     PubMed     Google Scholar     ","['https://doi.org/10.1097/00000658-197801000-00001', 'https://www.ncbi.nlm.nih.gov/pubmed/413500', 'https://scholar.google.com/scholar_lookup?title=Neonatal+necrotizing+enterocolitis.+Therapeutic+decisions+based+upon+clinical+staging&author=MJ+Bell&author=JL+Ternberg&author=RD+Feigin&author=JP+Keating&author=R+Marshall&author=L+Barton&publication_year=1978&hl=en']",413500,https://doi.org/10.1097/00000658-197801000-00001, Bell 1978 ,additional,CD013588-bbs2-0037,,,,,,,413500
CD013588-bib-0038,"Bell EF, Warburton D, Stonestreet BS, Oh W. ",Effect of fluid administration on the development of symptomatic patent ductus arteriosus and congestive heart failure in premature infants, New England Journal of Medicine ,1980,302,    ,['citation-journal']," Bell EF, Warburton D, Stonestreet BS, Oh W. Effect of fluid administration on the development of symptomatic patent ductus arteriosus and congestive heart failure in premature infants.  New England Journal of Medicine 1980;302(11):598-604. [DOI: 10.1056/NEJM198003133021103] [PMID: 7351906]    Link to article     PubMed     Google Scholar     ","['https://doi.org/10.1056/NEJM198003133021103', 'https://www.ncbi.nlm.nih.gov/pubmed/7351906', 'https://scholar.google.com/scholar_lookup?title=Effect+of+fluid+administration+on+the+development+of+symptomatic+patent+ductus+arteriosus+and+congestive+heart+failure+in+premature+infants+&author=EF+Bell&author=D+Warburton&author=BS+Stonestreet&author=W+Oh&publication_year=1980&hl=en']",7351906,https://doi.org/10.1056/NEJM198003133021103, Bell 1980 ,additional,CD013588-bbs2-0038,7351906,7351906,,,,,7351906
CD013588-bib-0039,Benitz WE. ,Treatment of persistent patent ductus arteriosus in preterm infants: time to accept the null hypothesis?, Journal of Perinatology ,2010,30,    ,['citation-journal'], Benitz WE. Treatment of persistent patent ductus arteriosus in preterm infants: time to accept the null hypothesis? Journal of Perinatology 2010;30(4):241-52. [DOI: 10.1038/jp.2010.3] [PMID: 20182439]    Link to article     PubMed     Google Scholar     ,"['https://doi.org/10.1038/jp.2010.3', 'https://www.ncbi.nlm.nih.gov/pubmed/20182439', 'https://scholar.google.com/scholar_lookup?title=Treatment+of+persistent+patent+ductus+arteriosus+in+preterm+infants:+time+to+accept+the+null+hypothesis?+&author=WE+Benitz&publication_year=2010&hl=en']",20182439,https://doi.org/10.1038/jp.2010.3, Benitz 2010 ,additional,CD013588-bbs2-0039,20182439,20182439,,,,,20182439
CD013588-bib-0040,"Benitz WE, Committee on Fetus and Newborn, American Academy of Pediatrics. ",Patent ductus arteriosus in preterm infants, Pediatrics ,2016,137,    ,['citation-journal']," Benitz WE, Committee on Fetus and Newborn, American Academy of Pediatrics. Patent ductus arteriosus in preterm infants.  Pediatrics 2016;137(1):e20153730. [DOI: 10.1542/peds.2015-3730] [PMID: 26672023]    Link to article     Google Scholar     ","['https://doi.org/10.1542/peds.2015-3730', 'https://scholar.google.com/scholar_lookup?title=Patent+ductus+arteriosus+in+preterm+infants&author=WE+Benitz&publication_year=2016&hl=en']",,https://doi.org/10.1542/peds.2015-3730, Benitz 2016 ,additional,CD013588-bbs2-0040,,,,,,,
CD013588-bib-0041,"Bravo MC, Cabaňas F, Riera J, Pérez-Fernández E, Quero J, Pérez-Rodriguez J, et al. ",Randomized controlled clinical trial of standard versus echocardiographically guided ibuprofen treatment for patent ductus arteriosus in preterm infants: a pilot study, Journal of Maternal-fetal & Neonatal Medicine ,2014,27,    ,['citation-journal']," Bravo MC, Cabaňas F, Riera J, Pérez-Fernández E, Quero J, Pérez-Rodriguez J, et al. Randomized controlled clinical trial of standard versus echocardiographically guided ibuprofen treatment for patent ductus arteriosus in preterm infants: a pilot study.  Journal of Maternal-fetal & Neonatal Medicine 2014;27(9):904-9. CENTRAL [DOI: 10.3109/14767058.2013.846312] [PMID: 24047189]    Link to article     Google Scholar     ","['', 'https://doi.org/10.3109/14767058.2013.846312', 'https://scholar.google.com/scholar_lookup?title=Randomized+controlled+clinical+trial+of+standard+versus+echocardiographically+guided+ibuprofen+treatment+for+patent+ductus+arteriosus+in+preterm+infants:+a+pilot+study+&author=MC+Bravo&author=F+Cabaňas&author=J+Riera&author=E+Pérez-Fernández&author=J+Quero&author=J+Pérez-Rodriguez&publication_year=2014&hl=en']",,https://doi.org/10.3109/14767058.2013.846312, Bravo 2014 ,additional,CD013588-bbs2-0041,,,,,,,
