reference_id,authors,title,journal,year,volume,citation_footer,citation_type,citation,urls,pubmed_id,doi,header,reference_type,study_id,exclusion_reason,PUBMED_ID_TITLE_AUTHORS,PUBMED_ID_TITLE,PUBMED_ID_S2,N_CITATIONS,S2_PDF_LINK,CORE_PDF_LINK,PUBMED_ID
CD014383-bib-0108,"Kaneda Y, Sumiyoshi T, Keefe R, Ishimoto Y, Numata S, Ohmori T. ",Brief Assessment of Cognition in Schizophrenia: validation of the Japanese version, Psychiatry and Clinical Neurosciences ,2007,61,    ,['citation-journal']," Kaneda Y, Sumiyoshi T, Keefe R, Ishimoto Y, Numata S, Ohmori T. Brief Assessment of Cognition in Schizophrenia: validation of the Japanese version.  Psychiatry and Clinical Neurosciences 2007;61:602-9. [DOI: 10.1111/j.1440-1819.2007.01725.x]    Link to article     PubMed     Google Scholar     ","['https://doi.org/10.1111/j.1440-1819.2007.01725.x', 'https://www.ncbi.nlm.nih.gov/pubmed/18081619', 'https://scholar.google.com/scholar_lookup?title=Brief+Assessment+of+Cognition+in+Schizophrenia:+validation+of+the+Japanese+version&author=Y+Kaneda&author=T+Sumiyoshi&author=R+Keefe&author=Y+Ishimoto&author=S+Numata&author=T+Ohmori&publication_year=2007&hl=en']",18081619,https://doi.org/10.1111/j.1440-1819.2007.01725.x, Kaneda 2007 ,additional,CD014383-bbs2-0056,,18081619,,18081619,246,https://onlinelibrary.wiley.com/doi/pdfdirect/10.1111/j.1440-1819.2007.01725.x,,18081619
CD014383-bib-0109,"Kapur S, Zipursky R, Jones C, Remington G, Houle S. ","Relationship between dopamine D(2) occupancy, clinical response, and side effects: a double-blind PET study of first-episode schizophrenia", American Journal of Psychiatry ,2000,157,    ,['citation-journal']," Kapur S, Zipursky R, Jones C, Remington G, Houle S. Relationship between dopamine D(2) occupancy, clinical response, and side effects: a double-blind PET study of first-episode schizophrenia.  American Journal of Psychiatry 2000;157:514-20. [DOI: 10.1176/appi.ajp.157.4.514] [PMID: 10739409]    Link to article     PubMed     Google Scholar     ","['https://doi.org/10.1176/appi.ajp.157.4.514', 'https://www.ncbi.nlm.nih.gov/pubmed/10739409', 'https://scholar.google.com/scholar_lookup?title=Relationship+between+dopamine+D(2)+occupancy,+clinical+response,+and+side+effects:+a+double-blind+PET+study+of+first-episode+schizophrenia+&author=S+Kapur&author=R+Zipursky&author=C+Jones&author=G+Remington&author=S+Houle&publication_year=2000&hl=en']",10739409,https://doi.org/10.1176/appi.ajp.157.4.514, Kapur 2000 ,additional,CD014383-bbs2-0057,,10739409,10739409,10739409,1079,,,10739409
CD014383-bib-0110,"Kay SR, Opler LA, Fiszbein A. ",,Positive and Negative Syndrome Scale (PANSS) Manual,1986,,.   ,['citation-book']," Kay SR, Opler LA, Fiszbein A. Positive and Negative Syndrome Scale (PANSS) Manual. North Tonawanda (NY): Multi-Health Systems, 1986.    ",[],,, Kay 1986 ,additional,CD014383-bbs2-0058,,1935026,,,,,,1935026
CD014383-bib-0111,"Lefebvre C, Glanville J, Briscoe S, Littlewood A, Marshall C, Metzendorf M, et al. Chapter 4: Searching for and selecting studies. In: Higgins JP, Thomas J, Chandler J, Cumpston M, Li T, Page MJ, et al, editors(s). ",,Cochrane Handbook for Systematic Reviews of Interventions,2019,,    ,['citation-book']," Lefebvre C, Glanville J, Briscoe S, Littlewood A, Marshall C, Metzendorf M, et al. Chapter 4: Searching for and selecting studies. In: Higgins JP, Thomas J, Chandler J, Cumpston M, Li T, Page MJ, et al, editors(s). Cochrane Handbook for Systematic Reviews of Interventions. 2nd edition. Chichester (UK): John Wiley and Sons, 2019:67-107. [DOI: 10.1002/9781119536604.ch4]    Link to article     ",['https://doi.org/10.1002/9781119536604.ch4'],,https://doi.org/10.1002/9781119536604.ch4, Lefebvre 2019 ,additional,CD014383-bbs2-0059,,,,,407,https://methods.cochrane.org/sites/methods.cochrane.org.irmg/files/public/uploads/Annotatedbibliographtifyingunpublishedstudies.pdf,,
CD014383-bib-0112,"Leon AC, Mallinckrodt CH, Chuang-Stein C, Archibald DG, Archer GE, Chartier K. ",Attrition in randomized controlled clinical trials: methodological issues in psychopharmacology, Biological Psychiatry ,2006,59,    ,['citation-journal']," Leon AC, Mallinckrodt CH, Chuang-Stein C, Archibald DG, Archer GE, Chartier K. Attrition in randomized controlled clinical trials: methodological issues in psychopharmacology.  Biological Psychiatry 2006;59(11):1001-5. [DOI: 10.1016/j.biopsych.2005.10.020] [PMID: 16503329]    Link to article     PubMed     Google Scholar     ","['https://doi.org/10.1016/j.biopsych.2005.10.020', 'https://www.ncbi.nlm.nih.gov/pubmed/16503329', 'https://scholar.google.com/scholar_lookup?title=Attrition+in+randomized+controlled+clinical+trials:+methodological+issues+in+psychopharmacology&author=AC+Leon&author=CH+Mallinckrodt&author=C+Chuang-Stein&author=DG+Archibald&author=GE+Archer&author=K+Chartier&publication_year=2006&hl=en']",16503329,https://doi.org/10.1016/j.biopsych.2005.10.020, Leon 2006 ,additional,CD014383-bbs2-0060,,16503329,16503329,16503329,272,,,16503329
CD014383-bib-0113,"Leucht S, Kane JM, Kissling W, Hamann J, Etschel E, Engel R. ",Clinical implications of Brief Psychiatric Rating Scale scores, British Journal of Psychiatry ,2005,187,    ,['citation-journal']," Leucht S, Kane JM, Kissling W, Hamann J, Etschel E, Engel R. Clinical implications of Brief Psychiatric Rating Scale scores.  British Journal of Psychiatry 2005;187:366-71. [DOI: 10.1192/bjp.187.4.366] [PMID: 16199797]    Link to article     Google Scholar     ","['https://doi.org/10.1192/bjp.187.4.366', 'https://scholar.google.com/scholar_lookup?title=Clinical+implications+of+Brief+Psychiatric+Rating+Scale+scores&author=S+Leucht&author=JM+Kane&author=W+Kissling&author=J+Hamann&author=E+Etschel&author=R+Engel&publication_year=2005&hl=en']",,https://doi.org/10.1192/bjp.187.4.366, Leucht 2005a ,additional,CD014383-bbs2-0061,,16823384,,16199797,799,https://www.cambridge.org/core/services/aop-cambridge-core/content/view/94B18AC4BF64EE393D64479889623D30/S0007125000168084a.pdf/div-class-title-clinical-implications-of-brief-psychiatric-rating-scale-scores-div.pdf,,16199797
CD014383-bib-0114,"Leucht S, Kane JM, Kissling W, Hamann J, Etschel E, Engel RR. ",What does the PANSS mean?, Schizophrenia Research ,2005,79,    ,['citation-journal']," Leucht S, Kane JM, Kissling W, Hamann J, Etschel E, Engel RR. What does the PANSS mean? Schizophrenia Research 2005;79(2-3):231-8. [DOI: 10.1016/j.schres.2005.04.008] [PMID: 15982856]    Link to article     PubMed     Google Scholar     ","['https://doi.org/10.1016/j.schres.2005.04.008', 'https://www.ncbi.nlm.nih.gov/pubmed/15982856', 'https://scholar.google.com/scholar_lookup?title=What+does+the+PANSS+mean?&author=S+Leucht&author=JM+Kane&author=W+Kissling&author=J+Hamann&author=E+Etschel&author=RR+Engel&publication_year=2005&hl=en']",15982856,https://doi.org/10.1016/j.schres.2005.04.008, Leucht 2005b ,additional,CD014383-bbs2-0062,,16823384,,15982856,1139,,,15982856
CD014383-bib-0115,"Leucht S, Tardy M, Komossa K, Heres S, Kissling W, Davis JM. ",Maintenance treatment with antipsychotic drugs for schizophrenia, Cochrane Database of Systematic Reviews ,2012,,    ,['citation-journal']," Leucht S, Tardy M, Komossa K, Heres S, Kissling W, Davis JM. Maintenance treatment with antipsychotic drugs for schizophrenia.  Cochrane Database of Systematic Reviews 2012, Issue 5. Art. No: CD008016. [DOI: 10.1002/14651858.CD008016.pub2]    Link to article     Google Scholar     ","['https://doi.org/10.1002/14651858.CD008016.pub2', 'https://scholar.google.com/scholar_lookup?title=Maintenance+treatment+with+antipsychotic+drugs+for+schizophrenia&author=S+Leucht&author=M+Tardy&author=K+Komossa&author=S+Heres&author=W+Kissling&author=JM+Davis&publication_year=2012&hl=en']",,https://doi.org/10.1002/14651858.CD008016.pub2, Leucht 2012 ,additional,CD014383-bbs2-0063,,32840872,,22592725,343,https://figshare.com/articles/journal_contribution/Maintenance_treatment_with_antipsychotic_drugs_for_schizophrenia/10757315/1/files/19268951.pdf,,22592725
CD014383-bib-0116,"Leucht S, Cipriani A, Spineli L, Mavridis D, Orey D, Richter F, et al. ",Comparative efficacy and tolerability of 15 antipsychotic drugs in schizophrenia: a multiple-treatments meta-analysis, Lancet ,2013,382,    ,['citation-journal']," Leucht S, Cipriani A, Spineli L, Mavridis D, Orey D, Richter F, et al. Comparative efficacy and tolerability of 15 antipsychotic drugs in schizophrenia: a multiple-treatments meta-analysis.  Lancet 2013;382:951-62. [DOI: 10.1016/S0140-6736(13)60733-3] [PMID: 23810019]    Link to article     PubMed     Google Scholar     ","['https://doi.org/10.1016/S0140-6736(13)60733-3', 'https://www.ncbi.nlm.nih.gov/pubmed/23810019', 'https://scholar.google.com/scholar_lookup?title=Comparative+efficacy+and+tolerability+of+15+antipsychotic+drugs+in+schizophrenia:+a+multiple-treatments+meta-analysis+&author=S+Leucht&author=A+Cipriani&author=L+Spineli&author=D+Mavridis&author=D+Orey&author=F+Richter&publication_year=2013&hl=en']",23810019,https://doi.org/10.1016/S0140-6736(13)60733-3, Leucht 2013 ,additional,CD014383-bbs2-0064,,,,23810019,2222,,,23810019
CD014383-bib-0117,"Leucht S, Leucht C, Huhn M, Chaimani A, Mavridis D, Helfer B, et al. ","Sixty years of placebo-controlled antipsychotic drug trials in acute schizophrenia: systematic review, Bayesian meta-analysis, and meta-regression of efficacy predictors", American Journal of Psychiatry ,2017,174,    ,['citation-journal']," Leucht S, Leucht C, Huhn M, Chaimani A, Mavridis D, Helfer B, et al. Sixty years of placebo-controlled antipsychotic drug trials in acute schizophrenia: systematic review, Bayesian meta-analysis, and meta-regression of efficacy predictors.  American Journal of Psychiatry 2017;174(10):927-42. [DOI: 10.1176/appi.ajp.2017.16121358] [PMID: 28541090]    Link to article     PubMed     Google Scholar     ","['https://doi.org/10.1176/appi.ajp.2017.16121358', 'https://www.ncbi.nlm.nih.gov/pubmed/28541090', 'https://scholar.google.com/scholar_lookup?title=Sixty+years+of+placebo-controlled+antipsychotic+drug+trials+in+acute+schizophrenia:+systematic+review,+Bayesian+meta-analysis,+and+meta-regression+of+efficacy+predictors+&author=S+Leucht&author=C+Leucht&author=M+Huhn&author=A+Chaimani&author=D+Mavridis&author=B+Helfer&publication_year=2017&hl=en']",28541090,https://doi.org/10.1176/appi.ajp.2017.16121358, Leucht 2017 ,additional,CD014383-bbs2-0065,,,28541090,,,,,28541090
CD014383-bib-0118,"Marshall M, Lockwood A, Bradley C, Adams C, Joy C, Fenton M. ",Unpublished rating scales: a major source of bias in randomised controlled trials of treatments for schizophrenia, British Journal of Psychiatry ,2000,176,    ,['citation-journal']," Marshall M, Lockwood A, Bradley C, Adams C, Joy C, Fenton M. Unpublished rating scales: a major source of bias in randomised controlled trials of treatments for schizophrenia.  British Journal of Psychiatry 2000;176:249-52. [DOI: 10.1192/bjp.176.3.249] [PMID: 10755072]    Link to article     Google Scholar     ","['https://doi.org/10.1192/bjp.176.3.249', 'https://scholar.google.com/scholar_lookup?title=Unpublished+rating+scales:+a+major+source+of+bias+in+randomised+controlled+trials+of+treatments+for+schizophrenia+&author=M+Marshall&author=A+Lockwood&author=C+Bradley&author=C+Adams&author=C+Joy&author=M+Fenton&publication_year=2000&hl=en']",,https://doi.org/10.1192/bjp.176.3.249, Marshall 2000 ,additional,CD014383-bbs2-0066,,,,10755072,694,https://www.cambridge.org/core/services/aop-cambridge-core/content/view/B7234A75D107190562603C61F2487521/S0007125000264374a.pdf/div-class-title-unpublished-rating-scales-a-major-source-of-bias-in-randomised-controlled-trials-of-treatments-for-schizophrenia-div.pdf,,10755072
CD014383-bib-0119,"Matsui K, Tokumasu T, Takekita Y, Inada K, Kanazawa T, Kishimoto T, et al. ",Switching to antipsychotic monotherapy vs. staying on antipsychotic polypharmacy in schizophrenia: a systematic review and meta-analysis, Schizophrenia Research ,2019,209,    ,['citation-journal']," Matsui K, Tokumasu T, Takekita Y, Inada K, Kanazawa T, Kishimoto T, et al. Switching to antipsychotic monotherapy vs. staying on antipsychotic polypharmacy in schizophrenia: a systematic review and meta-analysis.  Schizophrenia Research 2019;209:50-7. [DOI: 10.1016/j.schres.2019.05.030]    Link to article     PubMed     Google Scholar     ","['https://doi.org/10.1016/j.schres.2019.05.030', 'https://www.ncbi.nlm.nih.gov/pubmed/31182319', 'https://scholar.google.com/scholar_lookup?title=Switching+to+antipsychotic+monotherapy+vs.+staying+on+antipsychotic+polypharmacy+in+schizophrenia:+a+systematic+review+and+meta-analysis+&author=K+Matsui&author=T+Tokumasu&author=Y+Takekita&author=K+Inada&author=T+Kanazawa&author=T+Kishimoto&publication_year=2019&hl=en']",31182319,https://doi.org/10.1016/j.schres.2019.05.030, Matsui 2019 ,additional,CD014383-bbs2-0067,,,31182319,31182319,32,,,31182319
CD014383-bib-0120,"McGrath J, Saha S, Chant D, Welham J. ","Schizophrenia: a concise overview of incidence, prevalence, and mortality", Epidemiological Reviews ,2008,30,    ,['citation-journal']," McGrath J, Saha S, Chant D, Welham J. Schizophrenia: a concise overview of incidence, prevalence, and mortality.  Epidemiological Reviews 2008;30:67-76. [DOI: 10.1093/epirev/mxn001] [PMID: 18480098]    Link to article     Google Scholar     ","['https://doi.org/10.1093/epirev/mxn001', 'https://scholar.google.com/scholar_lookup?title=Schizophrenia:+a+concise+overview+of+incidence,+prevalence,+and+mortality&author=J+McGrath&author=S+Saha&author=D+Chant&author=J+Welham&publication_year=2008&hl=en']",,https://doi.org/10.1093/epirev/mxn001, McGrath 2008 ,additional,CD014383-bbs2-0068,,18480098,18480098,18480098,2165,https://academic.oup.com/epirev/article-pdf/30/1/67/1717948/mxn001.pdf,,18480098
CD014383-bib-0121,"Misawa F, Shimizu K, Fujii Y, Miyata R, Koshiishi F, Kobayashi M, et al. ",Is antipsychotic polypharmacy associated with metabolic syndrome even after adjustment for life-style effects? A cross-sectional study, BMC Psychiatry ,2011,11,    ,['citation-journal']," Misawa F, Shimizu K, Fujii Y, Miyata R, Koshiishi F, Kobayashi M, et al. Is antipsychotic polypharmacy associated with metabolic syndrome even after adjustment for life-style effects? A cross-sectional study.  BMC Psychiatry 2011;11:118. [DOI: 10.1186/1471-244X-11-118] [PMID: 21791046]    Link to article     PubMed     Google Scholar     ","['https://doi.org/10.1186/1471-244X-11-118', 'https://www.ncbi.nlm.nih.gov/pubmed/21791046', 'https://scholar.google.com/scholar_lookup?title=Is+antipsychotic+polypharmacy+associated+with+metabolic+syndrome+even+after+adjustment+for+life-style+effects?+A+cross-sectional+study+&author=F+Misawa&author=K+Shimizu&author=Y+Fujii&author=R+Miyata&author=F+Koshiishi&author=M+Kobayashi&publication_year=2011&hl=en']",21791046,https://doi.org/10.1186/1471-244X-11-118, Misawa 2011 ,additional,CD014383-bbs2-0069,,,,21791046,91,https://bmcpsychiatry.biomedcentral.com/counter/pdf/10.1186/1471-244X-11-118,,21791046
CD014383-bib-0122,"Moreno-Küstner B, Martín C, Pastor L. ",Prevalence of psychotic disorders and its association with methodological issues. A systematic review and meta-analyses, PLOS One ,2018,13,    ,['citation-journal']," Moreno-Küstner B, Martín C, Pastor L. Prevalence of psychotic disorders and its association with methodological issues. A systematic review and meta-analyses.  PLOS One 2018;13:e0195687. [DOI: 10.1371/journal.pone.0195687] [PMID: 29649252]    Link to article     PubMed     Google Scholar     ","['https://doi.org/10.1371/journal.pone.0195687', 'https://www.ncbi.nlm.nih.gov/pubmed/29649252', 'https://scholar.google.com/scholar_lookup?title=Prevalence+of+psychotic+disorders+and+its+association+with+methodological+issues.+A+systematic+review+and+meta-analyses+&author=B+Moreno-Küstner&author=C+Martín&author=L+Pastor&publication_year=2018&hl=en']",29649252,https://doi.org/10.1371/journal.pone.0195687, Moreno‐Küstner 2018 ,additional,CD014383-bbs2-0070,,29649252,,29649252,424,https://journals.plos.org/plosone/article/file?id=10.1371/journal.pone.0195687&type=printable,,29649252
CD014383-bib-0123,"Overall JE, Gorham DR. ",The Brief Psychiatric Rating Scale, Psychological Reports ,1962,10,    ,['citation-journal']," Overall JE, Gorham DR. The Brief Psychiatric Rating Scale.  Psychological Reports 1962;10:799-812.    Link to article     Google Scholar     ","['https://doi.org/10.2466/pr0.1962.10.3.799', 'https://scholar.google.com/scholar_lookup?title=The+Brief+Psychiatric+Rating+Scale&author=JE+Overall&author=DR+Gorham&publication_year=1962&hl=en']",,https://doi.org/10.2466/pr0.1962.10.3.799, Overall 1962 ,additional,CD014383-bbs2-0071,,,,,11325,,,
CD014383-bib-0124,"Palmer BA, Pankratz VS, Bostwick J. ",The lifetime risk of suicide in schizophrenia: a reexamination, Archives of General Psychiatry ,2005,62,    ,['citation-journal']," Palmer BA, Pankratz VS, Bostwick J. The lifetime risk of suicide in schizophrenia: a reexamination.  Archives of General Psychiatry 2005;62:247-53. [DOI: 10.1001/archpsyc.62.3.247] [PMID: 15753237]    Link to article     PubMed     Google Scholar     ","['https://doi.org/10.1001/archpsyc.62.3.247', 'https://www.ncbi.nlm.nih.gov/pubmed/15753237', 'https://scholar.google.com/scholar_lookup?title=The+lifetime+risk+of+suicide+in+schizophrenia:+a+reexamination&author=BA+Palmer&author=VS+Pankratz&author=J+Bostwick&publication_year=2005&hl=en']",15753237,https://doi.org/10.1001/archpsyc.62.3.247, Palmer 2005 ,additional,CD014383-bbs2-0072,,15753237,,15753237,1030,,,15753237
CD014383-bib-0125,"Patel MX, Bishara D, Jayakumar S, Zalewska K, Shiers D, Crawford MJ, et al. ",Quality of prescribing for schizophrenia: evidence from a national audit in England and Wales, European Neuropsychopharmacology ,2014,24,    ,['citation-journal']," Patel MX, Bishara D, Jayakumar S, Zalewska K, Shiers D, Crawford MJ, et al. Quality of prescribing for schizophrenia: evidence from a national audit in England and Wales.  European Neuropsychopharmacology 2014;24:499-509. [DOI: 10.1016/j.euroneuro.2014.01.014] [PMID: 24491953]    Link to article     PubMed     Google Scholar     ","['https://doi.org/10.1016/j.euroneuro.2014.01.014', 'https://www.ncbi.nlm.nih.gov/pubmed/24491953', 'https://scholar.google.com/scholar_lookup?title=Quality+of+prescribing+for+schizophrenia:+evidence+from+a+national+audit+in+England+and+Wales+&author=MX+Patel&author=D+Bishara&author=S+Jayakumar&author=K+Zalewska&author=D+Shiers&author=MJ+Crawford&publication_year=2014&hl=en']",24491953,https://doi.org/10.1016/j.euroneuro.2014.01.014, Patel 2014 ,additional,CD014383-bbs2-0073,,,,24491953,79,,,24491953
CD014383-bib-0126,"Peters JL, Sutton AJ, Jones DR, Abrams KR, Rushton L. ",Contour-enhanced meta-analysis funnel plots help distinguish publication bias from other causes of asymmetry, Journal of Clinical Epidemiology ,2008,61,    ,['citation-journal']," Peters JL, Sutton AJ, Jones DR, Abrams KR, Rushton L. Contour-enhanced meta-analysis funnel plots help distinguish publication bias from other causes of asymmetry.  Journal of Clinical Epidemiology 2008;61(10):991-6. [DOI: 10.1016/j.jclinepi.2007.11.010] [PMID: 18538991]    Link to article     PubMed     Google Scholar     ","['https://doi.org/10.1016/j.jclinepi.2007.11.010', 'https://www.ncbi.nlm.nih.gov/pubmed/18538991', 'https://scholar.google.com/scholar_lookup?title=Contour-enhanced+meta-analysis+funnel+plots+help+distinguish+publication+bias+from+other+causes+of+asymmetry+&author=JL+Peters&author=AJ+Sutton&author=DR+Jones&author=KR+Abrams&author=L+Rushton&publication_year=2008&hl=en']",18538991,https://doi.org/10.1016/j.jclinepi.2007.11.010, Peters 2008 ,additional,CD014383-bbs2-0074,,18538991,18538991,18538991,1703,,,18538991
CD014383-bib-0127,"Popovic D, Benabarre A, Crespo JM, Goikolea JM, González-Pinto A, Gutiérrez-Rojas L, et al. ",Risk factors for suicide in schizophrenia: systematic review and clinical recommendations, Acta Psychiatrica Scandinavica ,2014,130,    ,['citation-journal']," Popovic D, Benabarre A, Crespo JM, Goikolea JM, González-Pinto A, Gutiérrez-Rojas L, et al. Risk factors for suicide in schizophrenia: systematic review and clinical recommendations.  Acta Psychiatrica Scandinavica 2014;130(6):418-26. [DOI: 10.1111/acps.12332] [PMID: 25230813]    Link to article     PubMed     Google Scholar     ","['https://doi.org/10.1111/acps.12332', 'https://www.ncbi.nlm.nih.gov/pubmed/25230813', 'https://scholar.google.com/scholar_lookup?title=Risk+factors+for+suicide+in+schizophrenia:+systematic+review+and+clinical+recommendations&author=D+Popovic&author=A+Benabarre&author=JM+Crespo&author=JM+Goikolea&author=A+González-Pinto&author=L+Gutiérrez-Rojas&publication_year=2014&hl=en']",25230813,https://doi.org/10.1111/acps.12332, Popovic 2014 ,additional,CD014383-bbs2-0075,,,,25230813,163,,,25230813
CD014383-bib-0128,,R: a language and environment for statistical computing,,2017,,. Available at www.R-project.org.   ,['citation-other']," R: a language and environment for statistical computing. Version 3.4.2. Vienna, Austria: R Foundation for Statistical Computing, 2017. Available at www.R-project.org.    ",[],,, R [Computer program] ,additional,CD014383-bbs2-0076,,,,,,,,
CD014383-bib-0129,"Ray WA, Chung CP, Murray KT, Hall K, Stein CM. ",Atypical antipsychotic drugs and the risk of sudden cardiac death, New England Journal of Medicine ,2009,360,    ,['citation-journal']," Ray WA, Chung CP, Murray KT, Hall K, Stein CM. Atypical antipsychotic drugs and the risk of sudden cardiac death.  New England Journal of Medicine 2009;360(3):225-35. [DOI: 10.1056/NEJMoa0806994] [PMID: 19144938]    Link to article     PubMed     Google Scholar     ","['https://doi.org/10.1056/NEJMoa0806994', 'https://www.ncbi.nlm.nih.gov/pubmed/19144938', 'https://scholar.google.com/scholar_lookup?title=Atypical+antipsychotic+drugs+and+the+risk+of+sudden+cardiac+death&author=WA+Ray&author=CP+Chung&author=KT+Murray&author=K+Hall&author=CM+Stein&publication_year=2009&hl=en']",19144938,https://doi.org/10.1056/NEJMoa0806994, Ray 2009 ,additional,CD014383-bbs2-0077,,19144938,,19144938,1130,https://www.nejm.org/doi/pdf/10.1056/NEJMx090054?articleTools=true,,19144938
CD014383-bib-0130,,Review Manager Web,,,,". Version 2.4.0. Cochrane, accessed 6 October 2020. Available at revman.cochrane.org/.   ",['citation-other']," Review Manager Web. Version 2.4.0. Cochrane, accessed 6 October 2020. Available at revman.cochrane.org/.    ",[],,, Review Manager Web [Computer program] ,additional,CD014383-bbs2-0078,,41700260,,,,,,41700260
CD014383-bib-0131,"Roberts MT, Shokraneh F, Sun Y, Groom M, Adams CE. ",Classification of psychotherapy interventions for people with schizophrenia: development of the Nottingham Classification of Psychotherapies, Evidence-Based Mental Health ,2021,24,    ,['citation-journal']," Roberts MT, Shokraneh F, Sun Y, Groom M, Adams CE. Classification of psychotherapy interventions for people with schizophrenia: development of the Nottingham Classification of Psychotherapies.  Evidence-Based Mental Health 2021;24:62-9. [DOI: 10.1136/ebmental-2020-300151]    Link to article     PubMed     Google Scholar     ","['https://doi.org/10.1136/ebmental-2020-300151', 'https://www.ncbi.nlm.nih.gov/pubmed/33355248', 'https://scholar.google.com/scholar_lookup?title=Classification+of+psychotherapy+interventions+for+people+with+schizophrenia:+development+of+the+Nottingham+Classification+of+Psychotherapies+&author=MT+Roberts&author=F+Shokraneh&author=Y+Sun&author=M+Groom&author=CE+Adams&publication_year=2021&hl=en']",33355248,https://doi.org/10.1136/ebmental-2020-300151, Roberts 2021 ,additional,CD014383-bbs2-0079,,33355248,33355248,33355248,14,https://www.ncbi.nlm.nih.gov/pmc/articles/PMC10231480,,33355248
CD014383-bib-0132,"Robinson D, Woerner MG, Alvir JM, Bilder R, Goldman R, Geisler S, et al. ",Predictors of relapse following response from a first episode of schizophrenia or schizoaffective disorder, Archives of General Psychiatry ,1999,56,    ,['citation-journal']," Robinson D, Woerner MG, Alvir JM, Bilder R, Goldman R, Geisler S, et al. Predictors of relapse following response from a first episode of schizophrenia or schizoaffective disorder.  Archives of General Psychiatry 1999;56:241-7. [DOI: 10.1001/archpsyc.56.3.241] [PMID: 10078501]    Link to article     PubMed     Google Scholar     ","['https://doi.org/10.1001/archpsyc.56.3.241', 'https://www.ncbi.nlm.nih.gov/pubmed/10078501', 'https://scholar.google.com/scholar_lookup?title=Predictors+of+relapse+following+response+from+a+first+episode+of+schizophrenia+or+schizoaffective+disorder+&author=D+Robinson&author=MG+Woerner&author=JM+Alvir&author=R+Bilder&author=R+Goldman&author=S+Geisler&publication_year=1999&hl=en']",10078501,https://doi.org/10.1001/archpsyc.56.3.241, Robinson 1999 ,additional,CD014383-bbs2-0080,,,,10078501,1326,,,10078501
