reference_id,authors,title,journal,year,volume,citation_footer,citation_type,citation,urls,pubmed_id,doi,header,reference_type,study_id,exclusion_reason,PUBMED_ID_TITLE_AUTHORS,PUBMED_ID_TITLE,PUBMED_ID_S2,N_CITATIONS,S2_PDF_LINK,CORE_PDF_LINK,PUBMED_ID
CD014383-bib-0054,"Locklear J, Lasser RA, Rodriguez SC, Turkoz I, Mahableshwarkar AR, Feifel D. ",Maintenance therapy with long-acting risperidone: functioning and quality of life in patients with schizophrenia or schizoaffective disorder, Schizophrenia Bulletin ,2005,31,    ,['citation-journal']," Locklear J, Lasser RA, Rodriguez SC, Turkoz I, Mahableshwarkar AR, Feifel D. Maintenance therapy with long-acting risperidone: functioning and quality of life in patients with schizophrenia or schizoaffective disorder.  Schizophrenia Bulletin 2005;31:494-5. CENTRAL    Google Scholar     ","['', 'https://scholar.google.com/scholar_lookup?title=Maintenance+therapy+with+long-acting+risperidone:+functioning+and+quality+of+life+in+patients+with+schizophrenia+or+schizoaffective+disorder+&author=J+Locklear&author=RA+Lasser&author=SC+Rodriguez&author=I+Turkoz&author=AR+Mahableshwarkar&author=D+Feifel&publication_year=2005&hl=en']",,, Simpson 2006 {published and unpublished data}  ,excluded,CD014383-bbs2-0016, Design: randomised Participants: people with stable schizophrenia Intervention: no polypharmacy reduction (comparison of different doses) ,,,,,,,
CD014383-bib-0055,"MacFadden W, Bossie C, Turkoz I, Diekamp B, Ibach B, Haskins JT. ",Effect of long-acting injectable risperidone on clinical outcomes in recently diagnosed stable schizophrenia patients,,,,   ,['citation-other']," MacFadden W, Bossie C, Turkoz I, Diekamp B, Ibach B, Haskins JT. Effect of long-acting injectable risperidone on clinical outcomes in recently diagnosed stable schizophrenia patients. 26th Collegium Internationale Neuro-Psychopharmacologicum Congress; 2008 Jul 13-17; Munich, Germany. CENTRAL    ",[''],,, Simpson 2006 {published and unpublished data}  ,excluded,CD014383-bbs2-0016, Design: randomised Participants: people with stable schizophrenia Intervention: no polypharmacy reduction (comparison of different doses) ,,,,,,,
CD014383-bib-0056,"MacFadden W, Bossie C, Turkoz I, Dorson P, Haskins T. ",Effect of long-acting injectable risperidone on clinical outcomes in stable schizophrenia patients with early illness,,,,   ,['citation-other']," MacFadden W, Bossie C, Turkoz I, Dorson P, Haskins T. Effect of long-acting injectable risperidone on clinical outcomes in stable schizophrenia patients with early illness. 161st Annual Meeting of the American Psychiatric Association; 2008 May 3-8; Washington (DC). CENTRAL    ",[''],,, Simpson 2006 {published and unpublished data}  ,excluded,CD014383-bbs2-0016, Design: randomised Participants: people with stable schizophrenia Intervention: no polypharmacy reduction (comparison of different doses) ,,,,,,,
CD014383-bib-0057,"MacFadden W, Bossie CA, Turkoz I, Haskins JT. ",Risperidone long-acting therapy in stable patients with recently diagnosed schizophrenia, International Clinical Psychopharmacology ,2010,25,    ,['citation-journal']," MacFadden W, Bossie CA, Turkoz I, Haskins JT. Risperidone long-acting therapy in stable patients with recently diagnosed schizophrenia.  International Clinical Psychopharmacology 2010;25(2):75-82. CENTRAL    Link to article     PubMed     Google Scholar     ","['', 'https://doi.org/10.1097/YIC.0b013e3283347cbf', 'https://www.ncbi.nlm.nih.gov/pubmed/20101185', 'https://scholar.google.com/scholar_lookup?title=Risperidone+long-acting+therapy+in+stable+patients+with+recently+diagnosed+schizophrenia&author=W+MacFadden&author=CA+Bossie&author=I+Turkoz&author=JT+Haskins&publication_year=2010&hl=en']",20101185,https://doi.org/10.1097/YIC.0b013e3283347cbf, Simpson 2006 {published and unpublished data}  ,excluded,CD014383-bbs2-0016, Design: randomised Participants: people with stable schizophrenia Intervention: no polypharmacy reduction (comparison of different doses) ,20101185,,20101185,20,,,20101185
CD014383-bib-0058,Mattys J. ,Improved cognition observed in patients with schizophrenia with risperidone long-acting injectable, European Neuropsychopharmacology ,2005,15,    ,['citation-journal'], Mattys J. Improved cognition observed in patients with schizophrenia with risperidone long-acting injectable.  European Neuropsychopharmacology 2005;15(Suppl 3):S497. CENTRAL    Google Scholar     ,"['', 'https://scholar.google.com/scholar_lookup?title=Improved+cognition+observed+in+patients+with+schizophrenia+with+risperidone+long-acting+injectable+&author=J+Mattys&publication_year=2005&hl=en']",,, Simpson 2006 {published and unpublished data}  ,excluded,CD014383-bbs2-0016, Design: randomised Participants: people with stable schizophrenia Intervention: no polypharmacy reduction (comparison of different doses) ,,,,,,,
CD014383-bib-0059,NCT00297388. ,"A 52-wk prospective, randomized, double-blind, multicenter study of relapse following transition from oral antipsychotic medication to 2 different doses (25 or 50 mg every 2 wks) of risperidone long-acting microspheres (Risperdal CONSTA) in adults with schizophrenia or schizoaffective disorder",,,,   ,['citation-other']," NCT00297388. A 52-wk prospective, randomized, double-blind, multicenter study of relapse following transition from oral antipsychotic medication to 2 different doses (25 or 50 mg every 2 wks) of risperidone long-acting microspheres (Risperdal CONSTA) in adults with schizophrenia or schizoaffective disorder. clinicaltrials.gov/ct2/show/NCT00297388 (first received 28 February 2006). CENTRAL    ",[''],,, Simpson 2006 {published and unpublished data}  ,excluded,CD014383-bbs2-0016, Design: randomised Participants: people with stable schizophrenia Intervention: no polypharmacy reduction (comparison of different doses) ,26974214,,,,,,26974214
CD014383-bib-0060,"Pandina G, Bilder R, Turkoz I, Alphs L. ","Identification of clinically meaningful relationships among cognition, functionality, and symptoms in subjects with schizophrenia or schizoaffective disorder", Schizophrenia Research ,2013,143,    ,['citation-journal']," Pandina G, Bilder R, Turkoz I, Alphs L. Identification of clinically meaningful relationships among cognition, functionality, and symptoms in subjects with schizophrenia or schizoaffective disorder.  Schizophrenia Research 2013;143(2-3):312-8. CENTRAL    Link to article     PubMed     Google Scholar     ","['', 'https://doi.org/10.1016/j.schres.2012.11.031', 'https://www.ncbi.nlm.nih.gov/pubmed/23276482', 'https://scholar.google.com/scholar_lookup?title=Identification+of+clinically+meaningful+relationships+among+cognition,+functionality,+and+symptoms+in+subjects+with+schizophrenia+or+schizoaffective+disorder+&author=G+Pandina&author=R+Bilder&author=I+Turkoz&author=L+Alphs&publication_year=2013&hl=en']",23276482,https://doi.org/10.1016/j.schres.2012.11.031, Simpson 2006 {published and unpublished data}  ,excluded,CD014383-bbs2-0016, Design: randomised Participants: people with stable schizophrenia Intervention: no polypharmacy reduction (comparison of different doses) ,23276482,,23276482,23,,,23276482
CD014383-bib-0061,"Pandina GJ, Gharabawi G, Rodriguez S, Lasser R. ",The relationship between cognitive measures and functional outcomes in schizophrenia,,,,   ,['citation-other']," Pandina GJ, Gharabawi G, Rodriguez S, Lasser R. The relationship between cognitive measures and functional outcomes in schizophrenia. 157th Annual Meeting of the American Psychiatric Association; 2004 May 1-6; New York (NY). CENTRAL    ",[''],,, Simpson 2006 {published and unpublished data}  ,excluded,CD014383-bbs2-0016, Design: randomised Participants: people with stable schizophrenia Intervention: no polypharmacy reduction (comparison of different doses) ,,,,,,,
CD014383-bib-0062,"Rodriguez SC, Kujawa M, Turkoz I, Rediess S, Gharabawi G. ",Long-acting risperidone treatment following antipsychotic polypharmacy,,,,   ,['citation-other']," Rodriguez SC, Kujawa M, Turkoz I, Rediess S, Gharabawi G. Long-acting risperidone treatment following antipsychotic polypharmacy. 159th Annual Meeting of the American Psychiatric Association; 2006 May 20-25; Toronto, Canada. CENTRAL    ",[''],,, Simpson 2006 {published and unpublished data}  ,excluded,CD014383-bbs2-0016, Design: randomised Participants: people with stable schizophrenia Intervention: no polypharmacy reduction (comparison of different doses) ,,,,,,,
CD014383-bib-0063,"Rodriguez SC, Lasser R, Turkoz I, Mahableshwarkar AR, Gharabawi GM, Chung H, et al. ",Optimized long-acting risperidone maintenance therapy,,,,   ,['citation-other']," Rodriguez SC, Lasser R, Turkoz I, Mahableshwarkar AR, Gharabawi GM, Chung H, et al. Optimized long-acting risperidone maintenance therapy. 158th Annual Meeting of the American Psychiatric Association; 2005 May 21-26; Atlanta (GA). CENTRAL    ",[''],,, Simpson 2006 {published and unpublished data}  ,excluded,CD014383-bbs2-0016, Design: randomised Participants: people with stable schizophrenia Intervention: no polypharmacy reduction (comparison of different doses) ,,,,,,,
CD014383-bib-0064,"Simpson GM, Mahmoud RA, Lasser RA, Kujawa M, Bossie CA, Turkoz I, et al. ",A 1-year double-blind study of 2 doses of long-acting risperidone in stable patients with schizophrenia or schizoaffective disorder, Journal of Clinical Psychiatry ,2006,67,    ,['citation-journal']," Simpson GM, Mahmoud RA, Lasser RA, Kujawa M, Bossie CA, Turkoz I, et al. A 1-year double-blind study of 2 doses of long-acting risperidone in stable patients with schizophrenia or schizoaffective disorder.  Journal of Clinical Psychiatry 2006;67(8):1194-203. CENTRAL    Link to article     PubMed     Google Scholar     ","['', 'https://doi.org/10.4088/JCP.v67n0804', 'https://www.ncbi.nlm.nih.gov/pubmed/16965196', 'https://scholar.google.com/scholar_lookup?title=A+1-year+double-blind+study+of+2+doses+of+long-acting+risperidone+in+stable+patients+with+schizophrenia+or+schizoaffective+disorder+&author=GM+Simpson&author=RA+Mahmoud&author=RA+Lasser&author=M+Kujawa&author=CA+Bossie&author=I+Turkoz&publication_year=2006&hl=en']",16965196,https://doi.org/10.4088/JCP.v67n0804, Simpson 2006 {published and unpublished data}  ,excluded,CD014383-bbs2-0016, Design: randomised Participants: people with stable schizophrenia Intervention: no polypharmacy reduction (comparison of different doses) ,,,16965196,92,,,16965196
CD014383-bib-0065,"Turkoz I, Lasser R, Rodriguez SC, Locklear JC, Mahableshwarkar AR, Gharabawi GM, et al. ",Functioning and quality of life during long-acting risperidone maintenance treatment,,,,   ,['citation-other']," Turkoz I, Lasser R, Rodriguez SC, Locklear JC, Mahableshwarkar AR, Gharabawi GM, et al. Functioning and quality of life during long-acting risperidone maintenance treatment. 158th Annual Meeting of the American Psychiatric Association; 2005 May 21-26; Atlanta (GA). CENTRAL    ",[''],,, Simpson 2006 {published and unpublished data}  ,excluded,CD014383-bbs2-0016, Design: randomised Participants: people with stable schizophrenia Intervention: no polypharmacy reduction (comparison of different doses) ,,,,,,,
CD014383-bib-0066,"Stahl S, Rupnow M, Greenspan A, Kosik-Gonzalez C, Zhu Y, Gharabawi G. ","Use and cost of polypharmacy in schizophrenia: data from a randomized, double-blind study of risperidone and quetiapine", Neuropsychopharmacology ,2004,29,    ,['citation-journal']," Stahl S, Rupnow M, Greenspan A, Kosik-Gonzalez C, Zhu Y, Gharabawi G. Use and cost of polypharmacy in schizophrenia: data from a randomized, double-blind study of risperidone and quetiapine.  Neuropsychopharmacology 2004;29(Suppl 1):S227. CENTRAL    Google Scholar     ","['', 'https://scholar.google.com/scholar_lookup?title=Use+and+cost+of+polypharmacy+in+schizophrenia:+data+from+a+randomized,+double-blind+study+of+risperidone+and+quetiapine+&author=S+Stahl&author=M+Rupnow&author=A+Greenspan&author=C+Kosik-Gonzalez&author=Y+Zhu&author=G+Gharabawi&publication_year=2004&hl=en']",,, Stahl 2004 {published data only}  ,excluded,CD014383-bbs2-0017, Design: randomised Population: not stable schizophrenia (acute exacerbation) ,17910802,,,,,,17910802
CD014383-bib-0067,"Sukegawa T, Ito T, Hasegawa M, Mizuno Y, Inagaki A, Sakamoto H, et al. ",A randomized controlled trial on the dose reduction and simplification for polypharmacy of antipsychotics, Tottori Journal of Clinical Research ,2008,1,    ,['citation-journal']," Sukegawa T, Ito T, Hasegawa M, Mizuno Y, Inagaki A, Sakamoto H, et al. A randomized controlled trial on the dose reduction and simplification for polypharmacy of antipsychotics.  Tottori Journal of Clinical Research 2008;1(1):169-81. CENTRAL    Google Scholar     ","['', 'https://scholar.google.com/scholar_lookup?title=A+randomized+controlled+trial+on+the+dose+reduction+and+simplification+for+polypharmacy+of+antipsychotics+&author=T+Sukegawa&author=T+Ito&author=M+Hasegawa&author=Y+Mizuno&author=A+Inagaki&author=H+Sakamoto&publication_year=2008&hl=en']",,, Sukegawa 2008 {published data only}  ,excluded,CD014383-bbs2-0018, Design: randomised Participants: people with stable schizophrenia Intervention: no polypharmacy reduction (combined dose reduction and polypharmacy reduction)  ,,,,,,,
CD014383-bib-0068,"Sumic JC, Baric V, Bilic P, Herceg M, Sisek-Sprem M, Jukic V. ",QTc and psychopharmacs: are there any differences between monotherapy and polytherapy, Annals of General Psychiatry ,2007,6,    ,['citation-journal']," Sumic JC, Baric V, Bilic P, Herceg M, Sisek-Sprem M, Jukic V. QTc and psychopharmacs: are there any differences between monotherapy and polytherapy.  Annals of General Psychiatry 2007;6:13. CENTRAL    Link to article     PubMed     Google Scholar     ","['', 'https://doi.org/10.1186/1744-859X-6-13', 'https://www.ncbi.nlm.nih.gov/pubmed/17477877', 'https://scholar.google.com/scholar_lookup?title=QTc+and+psychopharmacs:+are+there+any+differences+between+monotherapy+and+polytherapy&author=JC+Sumic&author=V+Baric&author=P+Bilic&author=M+Herceg&author=M+Sisek-Sprem&author=V+Jukic&publication_year=2007&hl=en']",17477877,https://doi.org/10.1186/1744-859X-6-13, Sumic 2007 {published data only}  ,excluded,CD014383-bbs2-0019, Design: not randomised ,17477877,17477877,17477877,22,https://annals-general-psychiatry.biomedcentral.com/track/pdf/10.1186/1744-859X-6-13,,17477877
CD014383-bib-0069,"Thompson A, Barley M, Sullivan SA, Strange SO, Moore L, Sipos A, et al. ",A pragmatic cluster randomised controlled trial of a complex ward-based intervention on antipsychotic polypharmacy prescribing in adult psychiatric inpatient wards,,,,   ,['citation-other']," Thompson A, Barley M, Sullivan SA, Strange SO, Moore L, Sipos A, et al. A pragmatic cluster randomised controlled trial of a complex ward-based intervention on antipsychotic polypharmacy prescribing in adult psychiatric inpatient wards. 13th Biennial Winter Workshop on Schizophrenia Research; 2006 Jan 1; Davos, Switzerland. CENTRAL    ",[''],,, Thompson 2008 {published data only}  ,excluded,CD014383-bbs2-0020, Design: randomised Participants: people with stable schizophrenia Intervention: no polypharmacy reduction ,,,,,,,
CD014383-bib-0070,"Thompson A, Sullivan SA, Barley M, Strange SO, Moore L, Rogers P, et al. ",The DEBIT trial: an intervention to reduce antipsychotic polypharmacy prescribing in adult psychiatry wards – a cluster randomized controlled trial, Psychological Medicine  ,2008,38,    ,['citation-journal']," Thompson A, Sullivan SA, Barley M, Strange SO, Moore L, Rogers P, et al. The DEBIT trial: an intervention to reduce antipsychotic polypharmacy prescribing in adult psychiatry wards – a cluster randomized controlled trial.  Psychological Medicine  2008;38(5):705-15. CENTRAL    Link to article     PubMed     Google Scholar     ","['', 'https://doi.org/10.1017/S003329170700147X', 'https://www.ncbi.nlm.nih.gov/pubmed/17825122', 'https://scholar.google.com/scholar_lookup?title=The+DEBIT+trial:+an+intervention+to+reduce+antipsychotic+polypharmacy+prescribing+in+adult+psychiatry+wards+–+a+cluster+randomized+controlled+trial+&author=A+Thompson&author=SA+Sullivan&author=M+Barley&author=SO+Strange&author=L+Moore&author=P+Rogers&publication_year=2008&hl=en']",17825122,https://doi.org/10.1017/S003329170700147X, Thompson 2008 {published data only}  ,excluded,CD014383-bbs2-0020, Design: randomised Participants: people with stable schizophrenia Intervention: no polypharmacy reduction ,,17825122,17825122,70,https://orca.cardiff.ac.uk/id/eprint/19271/1/Thompson%202008.pdf,,17825122
CD014383-bib-0071,"Veraksa A, Egorov A. ",Pharmacotherapy of acute psychotic states: the reason for benzodiazepines and valproic acid augmentation, European Psychiatry ,2016,33,    ,['citation-journal']," Veraksa A, Egorov A. Pharmacotherapy of acute psychotic states: the reason for benzodiazepines and valproic acid augmentation.  European Psychiatry 2016;33:S612. CENTRAL    Link to article     Google Scholar     ","['', 'https://doi.org/10.1016/j.eurpsy.2016.01.2287', 'https://scholar.google.com/scholar_lookup?title=Pharmacotherapy+of+acute+psychotic+states:+the+reason+for+benzodiazepines+and+valproic+acid+augmentation+&author=A+Veraksa&author=A+Egorov&publication_year=2016&hl=en']",,https://doi.org/10.1016/j.eurpsy.2016.01.2287, Veraksa 2016 {published data only}  ,excluded,CD014383-bbs2-0021," Design: randomised Population: not 80% schizophrenia, not stable schizophrenia ",,,,1,,,
CD014383-bib-0072,"Verdoorn S, Kwint HF, Blom JW, Gussekloo J, Bouvy ML. ","Effects of a clinical medication review focused on personal goals, quality of life, and health problems in older persons with polypharmacy: a randomised controlled trial (DREAMeR-study)", PLOS Medicine ,2019,16,    ,['citation-journal']," Verdoorn S, Kwint HF, Blom JW, Gussekloo J, Bouvy ML. Effects of a clinical medication review focused on personal goals, quality of life, and health problems in older persons with polypharmacy: a randomised controlled trial (DREAMeR-study).  PLOS Medicine 2019;16(5):e1002798. CENTRAL    Link to article     PubMed     Google Scholar     ","['', 'https://doi.org/10.1371/journal.pmed.1002798', 'https://www.ncbi.nlm.nih.gov/pubmed/31067214', 'https://scholar.google.com/scholar_lookup?title=Effects+of+a+clinical+medication+review+focused+on+personal+goals,+quality+of+life,+and+health+problems+in+older+persons+with+polypharmacy:+a+randomised+controlled+trial+(DREAMeR-study)+&author=S+Verdoorn&author=HF+Kwint&author=JW+Blom&author=J+Gussekloo&author=ML+Bouvy&publication_year=2019&hl=en']",31067214,https://doi.org/10.1371/journal.pmed.1002798, Verdoorn 2019 {published data only}  ,excluded,CD014383-bbs2-0022, Design: randomised Population: no schizophrenia  ,31067214,31067214,31067214,95,https://journals.plos.org/plosmedicine/article/file?id=10.1371/journal.pmed.1002798&type=printable,,31067214
CD014383-bib-0073,"Sukegawa T, Inagaki A, Yamanouchi Y, Inada T, Yoshio T, Yoshimura R, et al. ",Study protocol: safety correction of high dose antipsychotic polypharmacy in Japan, BMC Psychiatry ,2014,14,    ,['citation-journal']," Sukegawa T, Inagaki A, Yamanouchi Y, Inada T, Yoshio T, Yoshimura R, et al. Study protocol: safety correction of high dose antipsychotic polypharmacy in Japan.  BMC Psychiatry 2014;14(1):103. CENTRAL    Link to article     PubMed     Google Scholar     ","['', 'https://doi.org/10.1186/1471-244X-14-103', 'https://www.ncbi.nlm.nih.gov/pubmed/24708857', 'https://scholar.google.com/scholar_lookup?title=Study+protocol:+safety+correction+of+high+dose+antipsychotic+polypharmacy+in+Japan&author=T+Sukegawa&author=A+Inagaki&author=Y+Yamanouchi&author=T+Inada&author=T+Yoshio&author=R+Yoshimura&publication_year=2014&hl=en']",24708857,https://doi.org/10.1186/1471-244X-14-103, Yamanouchi 2015 {published data only}  ,excluded,CD014383-bbs2-0023, Design: randomised Participants: people with stable schizophrenia Intervention: no polypharmacy reduction (combined dose reduction and polypharmacy reduction)  ,,24708857,24708857,18,https://bmcpsychiatry.biomedcentral.com/counter/pdf/10.1186/1471-244X-14-103,,24708857
CD014383-bib-0074,UMIN000004511. ,The clinical study to correct multiple and large amount of administering to antipsychotic safely and effectively,,,,   ,['citation-other'], UMIN000004511. The clinical study to correct multiple and large amount of administering to antipsychotic safely and effectively. center6.umin.ac.jp/cgi-open-bin/ctr_e/ctr_view.cgi?recptno=R000005391 (first received 10 November 2010). CENTRAL    ,[''],,, Yamanouchi 2015 {published data only}  ,excluded,CD014383-bbs2-0023, Design: randomised Participants: people with stable schizophrenia Intervention: no polypharmacy reduction (combined dose reduction and polypharmacy reduction)  ,,,,,,,
CD014383-bib-0075,"Yamanouchi Y, Sukegawa T, Inagaki A, Inada T, Yoshio T, Yoshimura R, et al. ",Evaluation of the individual safe correction of antipsychotic agent polypharmacy in Japanese patients with chronic schizophrenia: validation of safe corrections for antipsychotic polypharmacy and the high-dose method, International Journal of Neuropsychopharmacology ,2015,18,    ,['citation-journal']," Yamanouchi Y, Sukegawa T, Inagaki A, Inada T, Yoshio T, Yoshimura R, et al. Evaluation of the individual safe correction of antipsychotic agent polypharmacy in Japanese patients with chronic schizophrenia: validation of safe corrections for antipsychotic polypharmacy and the high-dose method.  International Journal of Neuropsychopharmacology 2015;18:5. CENTRAL    Link to article     Google Scholar     ","['', 'https://doi.org/10.1093/ijnp/pyu016', 'https://scholar.google.com/scholar_lookup?title=Evaluation+of+the+individual+safe+correction+of+antipsychotic+agent+polypharmacy+in+Japanese+patients+with+chronic+schizophrenia:+validation+of+safe+corrections+for+antipsychotic+polypharmacy+and+the+high-dose+method+&author=Y+Yamanouchi&author=T+Sukegawa&author=A+Inagaki&author=T+Inada&author=T+Yoshio&author=R+Yoshimura&publication_year=2015&hl=en']",,https://doi.org/10.1093/ijnp/pyu016, Yamanouchi 2015 {published data only}  ,excluded,CD014383-bbs2-0023, Design: randomised Participants: people with stable schizophrenia Intervention: no polypharmacy reduction (combined dose reduction and polypharmacy reduction)  ,,25522380,25522380,23,https://academic.oup.com/ijnp/article-pdf/18/5/pyu016/7692283/pyu016.pdf,,25522380
CD014383-bib-0076,"Yoon HW, Lee JS, Park SJ, Lee SK, Choi WJ, Kim TY. ",Comparing the effectiveness and safety of the addition of and switching to aripiprazole for resolving antipsychotic-induced hyperprolactinemia, Clinical Neuropharmacology ,2016,39,    ,['citation-journal']," Yoon HW, Lee JS, Park SJ, Lee SK, Choi WJ, Kim TY. Comparing the effectiveness and safety of the addition of and switching to aripiprazole for resolving antipsychotic-induced hyperprolactinemia.  Clinical Neuropharmacology 2016;39:288-94. CENTRAL [DOI: 10.1097/WNF.0000000000000175]    Link to article     PubMed     Google Scholar     ","['', 'https://doi.org/10.1097/WNF.0000000000000175', 'https://www.ncbi.nlm.nih.gov/pubmed/27438182', 'https://scholar.google.com/scholar_lookup?title=Comparing+the+effectiveness+and+safety+of+the+addition+of+and+switching+to+aripiprazole+for+resolving+antipsychotic-induced+hyperprolactinemia+&author=HW+Yoon&author=JS+Lee&author=SJ+Park&author=SK+Lee&author=WJ+Choi&author=TY+Kim&publication_year=2016&hl=en']",27438182,https://doi.org/10.1097/WNF.0000000000000175, Yoon 2016 {published data only}  ,excluded,CD014383-bbs2-0024, Design: randomised Participants: people with stable schizophrenia Intervention: no polypharmacy reduction (switching to another antipsychotic) ,27438182,,27438182,31,,,27438182
CD014383-bib-0078,"Altman DG, Bland JM. ",Detecting skewness from summary information, BMJ ,1996,313,    ,['citation-journal']," Altman DG, Bland JM. Detecting skewness from summary information.  BMJ 1996;313(7066):1200. [DOI: 10.1136/bmj.313.7066.1200] [PMID: 8916759]    Link to article     PubMed     Google Scholar     ","['https://doi.org/10.1136/bmj.313.7066.1200', 'https://www.ncbi.nlm.nih.gov/pubmed/8916759', 'https://scholar.google.com/scholar_lookup?title=Detecting+skewness+from+summary+information&author=DG+Altman&author=JM+Bland&publication_year=1996&hl=en']",8916759,https://doi.org/10.1136/bmj.313.7066.1200, Altman 1996 ,additional,CD014383-bbs2-0026,,8916759,,8916759,866,https://www.bmj.com/content/bmj/313/7066/1200.1.full.pdf,,8916759
CD014383-bib-0079,"Andreasen N, Carpenter W, Kane J, Lasser R, Marder S, Weinberger D. ",Remission in schizophrenia: proposed criteria and rationale for consensus, American Journal of Psychiatry ,2005,62,    ,['citation-journal']," Andreasen N, Carpenter W, Kane J, Lasser R, Marder S, Weinberger D. Remission in schizophrenia: proposed criteria and rationale for consensus.  American Journal of Psychiatry 2005;62:441-9. [DOI: 10.1176/appi.ajp.162.3.441] [PMID: 15741458]    Link to article     Google Scholar     ","['https://doi.org/10.1176/appi.ajp.162.3.441', 'https://scholar.google.com/scholar_lookup?title=Remission+in+schizophrenia:+proposed+criteria+and+rationale+for+consensus&author=N+Andreasen&author=W+Carpenter&author=J+Kane&author=R+Lasser&author=S+Marder&author=D+Weinberger&publication_year=2005&hl=en']",,https://doi.org/10.1176/appi.ajp.162.3.441, Andreasen 2005 ,additional,CD014383-bbs2-0027,,15741458,,15741458,2314,,,15741458
